{
  "contract_version": "1.0.0",
  "scenario": "C",
  "direction": "outbound",
  "block_id": "BLK-O-0600",
  "block_start": "06:00",
  "block_end": "07:00",
  "duration_minutes": 60,
  "passenger_demand": 70,
  "demand_rate_per_hour": 70,
  "vehicle_capacity": 60,
  "a_trip_count": 1,
  "b_trip_count": 1,
  "c_planned_trip_count": 2,
  "c_actual_trip_count": 2,
  "trip_rate_per_hour": 2,
  "required_trips_85": 2,
  "required_trips_90": 2,
  "required_trip_rate_85": 2,
  "required_trip_rate_90": 2,
  "nominal_capacity": 120,
  "capacity_at_85": 102,
  "capacity_at_90": 108,
  "load_factor": 0.583333,
  "shortage": 0,
  "status": "WITHIN_PLANNING_CEILING",
  "allocation_reason": "Prevent critical morning overload while preserving daily trip totals.",
  "confidence": "high"
}
